{
  "$type": "org.prodid.item",
  "key": "TJ-2041-NVY-M",
  "brand": "Acme",
  "name": "Trail Jacket",
  "lang": "en",
  "group": "TJ-2041",
  "variant": { "color": "navy", "size": "M" },
  "identifiers": [
    { "scheme": "gtin", "value": "09506000134352" },
    { "scheme": "mpn", "value": "TJ-2041-NVY-M" }
  ],
  "markets": ["TR", "DE"],
  "properties": {
    "material": "100% recycled polyester",
    "madeIn": "TR",
    "weight": { "value": 480, "unit": "g" }
  },
  "media": [
    { "url": "https://acme.example/img/tj2041-navy.webp", "license": "CC-BY-4.0", "kind": "image" }
  ]
}
